{
  "version": 1,
  "generatedAt": "2026-03-27T22:48:44Z",
  "purpose": "Define what OpenCompliance publishes publicly versus privately when a framework depends on licensed or otherwise non-public source text.",
  "publicationTiers": [
    {
      "tierId": "public_structural_metadata",
      "title": "Public structural metadata",
      "allowedArtifacts": [
        "framework priority and source-availability state",
        "framework coverage counts",
        "control-family mappings",
        "review blocker records",
        "public-control route and fixture status"
      ]
    },
    {
      "tierId": "public_derived_mapping_metadata",
      "title": "Public derived mapping metadata",
      "allowedArtifacts": [
        "publication-safe control IDs",
        "relation semantics such as subset-of or intersects-with",
        "mapping-method metadata",
        "review status and confidence",
        "family-by-family rollout matrices"
      ]
    },
    {
      "tierId": "private_exact_anchor_corpus",
      "title": "Private exact-anchor corpus",
      "allowedArtifacts": [
        "licensed clause, Annex A, criterion, and point-of-focus anchors",
        "private source-to-atom mapping graph",
        "reviewer notes that quote or paraphrase licensed text beyond public-safe limits"
      ]
    },
    {
      "tierId": "licensed_review_outputs",
      "title": "Licensed review outputs",
      "allowedArtifacts": [
        "blocker resolutions",
        "review sign-off state",
        "private evidence that a public exact-anchor publication is defensible"
      ]
    }
  ],
  "frameworkPolicies": [
    {
      "framework": "ISO 27001",
      "sourceAvailability": "blocked_nonpublic_source_review",
      "publicAllowed": [
        "structural clause-versus-Annex-A state",
        "family-level mappings",
        "control-boundary metadata",
        "blocker-aware exact-anchor status"
      ],
      "privateAllowed": [
        "exact clause and Annex A review",
        "private source-to-atom graph",
        "licensed review notes"
      ],
      "publicBlocked": [
        "open publication of a full exact-anchor corpus without licensed review",
        "verbatim or near-verbatim reproduction of proprietary standard text"
      ]
    },
    {
      "framework": "SOC 2",
      "sourceAvailability": "blocked_nonpublic_source_review",
      "publicAllowed": [
        "criterion-family and point-of-focus group state",
        "public-control mappings",
        "blocker-aware exact-anchor status"
      ],
      "privateAllowed": [
        "exact criterion and point-of-focus review",
        "private source-to-atom graph",
        "licensed review notes"
      ],
      "publicBlocked": [
        "open publication of a full exact-anchor corpus without licensed review",
        "verbatim or near-verbatim reproduction of proprietary standard text"
      ]
    },
    {
      "framework": "ISO/IEC 27701",
      "sourceAvailability": "blocked_nonpublic_source_review",
      "publicAllowed": [
        "priority state",
        "family-level mappings",
        "candidate control coverage"
      ],
      "privateAllowed": [
        "licensed clause review",
        "private source-to-atom graph"
      ],
      "publicBlocked": [
        "public exact-anchor corpus until licensed review exists"
      ]
    },
    {
      "framework": "ISO/IEC 42001",
      "sourceAvailability": "crosswalk_candidate_requires_licensed_review",
      "publicAllowed": [
        "crosswalk-derived candidate anchors",
        "public blocker metadata",
        "candidate control coverage"
      ],
      "privateAllowed": [
        "licensed clause review",
        "private exact-anchor notes"
      ],
      "publicBlocked": [
        "claiming public reviewed exact anchors from crosswalk material alone"
      ]
    }
  ],
  "workflow": [
    {
      "step": 1,
      "name": "Public-safe decomposition and blocker publication",
      "output": "Public control-family mappings, coverage counts, and blocker-aware status files."
    },
    {
      "step": 2,
      "name": "Private exact-anchor review",
      "output": "Licensed review notes, private source-to-atom graph, and reviewer sign-off state."
    },
    {
      "step": 3,
      "name": "Publication decision",
      "output": "Decision on whether a derived public exact-anchor record is defensible to publish."
    },
    {
      "step": 4,
      "name": "External review",
      "output": "Independent reviewer challenge on mapping, route, and proof-boundary integrity."
    }
  ]
}
